{
  "schemaVersion": "bilingual-review/v1",
  "reviewId": "br-security-xhigh-author",
  "scope": {
    "moduleId": "security",
    "locale": "en",
    "objectType": "module",
    "objectId": null,
    "zhContentHash": "sha256:a8947ed7ac707e704487ff8d2766b35e7eaa8017bf6239a5612cfcdb279aae76",
    "enContentHash": "sha256:13f9a95b7253778e6e477acd303f3f01603c309ff086c84697877488e3ee041b",
    "termIds": [
      "acl",
      "dlp",
      "guardrails",
      "iam",
      "identity-authorization",
      "prompt-injection",
      "security"
    ],
    "sourceIds": [
      "mcp-authorization",
      "mcp-security",
      "nist-aml-100-2e2025",
      "nist-genai-profile",
      "nist-sp-800-218a",
      "nist-sp-800-61r3",
      "nist-zero-trust",
      "owasp-llm-top-ten",
      "owasp-prompt-injection",
      "owasp-vector-weaknesses"
    ]
  },
  "stage": "xhigh-author",
  "deterministic": [
    {
      "gateId": "english-module-contract",
      "status": "PASS",
      "evidence": [
        "The English module resolves every canonical term and source ID.",
        "Stable section, question, content-item, and evidence-card IDs are present.",
        "The complete-edition audit passes for this module."
      ]
    }
  ],
  "rubric": {
    "semanticFidelity": 5,
    "mechanismAccuracy": 5,
    "boundaryPreservation": 5,
    "evidenceFaithfulness": 5,
    "technicalEnglish": 4,
    "presalesUsability": 5
  },
  "findings": [],
  "verdict": "PASS",
  "blockClass": "NONE",
  "attempt": 1,
  "nextStage": "publish-candidate"
}
