{
  "schemaVersion": "bilingual-review/v1",
  "reviewId": "br-model-landscape-xhigh-author",
  "scope": {
    "moduleId": "model-landscape",
    "locale": "en",
    "objectType": "module",
    "objectId": null,
    "zhContentHash": "sha256:5ecbbf761e845034138f07b469f52a3914b452094489574838ad77e2c434b115",
    "enContentHash": "sha256:a3284c1637a926b3e3866313a4dc9d543cb040e54850f545fa7df9d3ff48c353",
    "termIds": [
      "access-spectrum",
      "capability-matrix",
      "llm",
      "model-landscape",
      "model-lifecycle",
      "model-routing",
      "poc",
      "sla",
      "tco"
    ],
    "sourceIds": [
      "anthropic-models",
      "deepseek-r1-2025",
      "finops-unit-economics",
      "google-models",
      "lost-middle",
      "nist-ai-800-3",
      "nist-genai-profile",
      "openai-models",
      "openai-reasoning-guide",
      "opentelemetry-genai-semconv",
      "osi-open-source-ai-definition-1-0"
    ]
  },
  "stage": "xhigh-author",
  "deterministic": [
    {
      "gateId": "english-module-contract",
      "status": "PASS",
      "evidence": [
        "The English module resolves every canonical term and source ID.",
        "Stable section, question, content-item, and evidence-card IDs are present.",
        "The complete-edition audit passes for this module."
      ]
    }
  ],
  "rubric": {
    "semanticFidelity": 5,
    "mechanismAccuracy": 5,
    "boundaryPreservation": 5,
    "evidenceFaithfulness": 5,
    "technicalEnglish": 4,
    "presalesUsability": 5
  },
  "findings": [],
  "verdict": "PASS",
  "blockClass": "NONE",
  "attempt": 1,
  "nextStage": "publish-candidate"
}
