{
  "schemaVersion": "bilingual-review/v1",
  "reviewId": "br-ai-gateway-ultra-exception",
  "scope": {
    "moduleId": "ai-gateway",
    "locale": "en",
    "objectType": "module",
    "objectId": null,
    "zhContentHash": "sha256:e425e454d16f8b3ac901b8d782b655a448caa4d5355825075a78aaa0cfe82647",
    "enContentHash": "sha256:d2e0ad09f0192a8ea318e2c158a57813de7e16c22a826f2c71660cf97ebbbe89",
    "termIds": [
      "ai-gateway",
      "api",
      "finops",
      "guardrails",
      "identity-authorization",
      "model-routing",
      "observability",
      "rate-limiting",
      "semantic-cache",
      "shadow-traffic",
      "slo"
    ],
    "sourceIds": [
      "aws-builders-library-retries",
      "azure-apim-ai-gateway",
      "cloudflare-ai-gateway",
      "cloudflare-ai-gateway-authentication",
      "cloudflare-ai-gateway-caching",
      "cloudflare-ai-gateway-dynamic-routing",
      "cloudflare-ai-gateway-spend-limits",
      "mcp-authorization",
      "nist-genai-profile",
      "nist-zero-trust",
      "opentelemetry-genai-semconv",
      "opentelemetry-semconv"
    ]
  },
  "stage": "ultra-exception",
  "deterministic": [
    {
      "gateId": "exception-adjudication",
      "status": "PASS",
      "evidence": [
        "The B1-B6 exception families are resolved and the shared-copy ownership policy covers the live conflict set.",
        "All canonical reading roles are present and all complete-edition, lint, build, and browser gates pass.",
        "No remaining content blocker was found in the final adjudication."
      ]
    }
  ],
  "rubric": {
    "semanticFidelity": 5,
    "mechanismAccuracy": 5,
    "boundaryPreservation": 5,
    "evidenceFaithfulness": 5,
    "technicalEnglish": 5,
    "presalesUsability": 5
  },
  "findings": [],
  "verdict": "PASS",
  "blockClass": "NONE",
  "attempt": 2,
  "nextStage": "publish-candidate"
}
