{
  "schemaVersion": "bilingual-review/v1",
  "reviewId": "br-veadk-2026-08-15-xhigh-semantic",
  "scope": {
    "moduleId": "veadk",
    "locale": "en",
    "objectType": "module",
    "objectId": null,
    "zhContentHash": "sha256:8306376004f68d101a376926f61d5b71af77a9c33e80fe5f7c05fd991c0a3dba",
    "enContentHash": "sha256:4acf5b63d33fa168fbcf091d0b21e46a8c2cb705184392ff6925e26737e26f35",
    "termIds": [
      "agent-runner",
      "agentkit-app-adapter",
      "google-adk",
      "root-agent",
      "short-term-memory",
      "tool-loop",
      "veadk"
    ],
    "sourceIds": [
      "agentkit-cli-commands-2026-08-15",
      "agentkit-cli-overview-2026-08-15",
      "agentkit-memory-quickstart-2026-08-15",
      "agentkit-platform-overview-2026-08-15",
      "agentkit-runtime-quickstart-2026-08-15",
      "mem0-oss-overview-2026-08-15",
      "mem0-platform-vs-oss-2026-08-15",
      "veadk-agent-source-2026-08-15",
      "veadk-agentkit-integration-2026-08-15",
      "veadk-builtin-tools-2026-08-15",
      "veadk-runner-source-2026-08-15",
      "veadk-short-term-memory-2026-08-15"
    ]
  },
  "stage": "xhigh-semantic",
  "deterministic": [
    {
      "gateId": "canonical-alignment",
      "status": "PASS",
      "evidence": [
        "Canonical question order, evidence relationships, source bindings, evidence-card order, and addedAt values were independently checked against the Chinese owner.",
        "Independent semantic review confirmed the framework, Runner, Tool authorization, Session, memory, and AgentKit adapter boundaries without adding unsupported production claims.",
        "The content distinguishes current VeADK inheritance from optional runtime modes and separates application packaging from Runtime deployment."
      ]
    }
  ],
  "rubric": {
    "semanticFidelity": 5,
    "mechanismAccuracy": 5,
    "boundaryPreservation": 5,
    "evidenceFaithfulness": 5,
    "technicalEnglish": 5,
    "presalesUsability": 5
  },
  "findings": [],
  "verdict": "PASS",
  "blockClass": "NONE",
  "attempt": 1,
  "nextStage": "publish-candidate"
}
