{
  "schemaVersion": "bilingual-review/v1",
  "reviewId": "br-ai-ops-xhigh-author",
  "scope": {
    "moduleId": "ai-ops",
    "locale": "en",
    "objectType": "module",
    "objectId": null,
    "zhContentHash": "sha256:8d496269104c52e046a2490956a74b2cd312bccc68310cdd1ce245a1dc4f56af",
    "enContentHash": "sha256:afb5f216d30ac51c24788f5ccb4bee7c5c823bedbf4eb2cb33d86babc6e02e38",
    "termIds": [
      "ai-application-engineering",
      "ai-ops",
      "ai-release-manifest",
      "configuration-bundle",
      "cost-allocation",
      "cost-anomaly",
      "genaiops",
      "golden-set",
      "observability",
      "release-evaluation",
      "shadow-traffic"
    ],
    "sourceIds": [
      "aws-genai-lifecycle",
      "azure-foundation-model-lifecycle",
      "azure-genaiops",
      "finops-ai-category",
      "finops-ai-overview",
      "finops-framework",
      "google-genai-app-lifecycle",
      "nist-genai-profile",
      "nist-zero-trust",
      "openai-eval-best-practices",
      "opentelemetry-genai-semconv",
      "opentelemetry-semconv",
      "opentelemetry-tail-sampling"
    ]
  },
  "stage": "xhigh-author",
  "deterministic": [
    {
      "gateId": "english-module-contract",
      "status": "PASS",
      "evidence": [
        "The English module resolves every canonical term and source ID.",
        "Stable section, question, content-item, and evidence-card IDs are present.",
        "The complete-edition audit passes for this module."
      ]
    }
  ],
  "rubric": {
    "semanticFidelity": 5,
    "mechanismAccuracy": 5,
    "boundaryPreservation": 5,
    "evidenceFaithfulness": 5,
    "technicalEnglish": 4,
    "presalesUsability": 5
  },
  "findings": [],
  "verdict": "PASS",
  "blockClass": "NONE",
  "attempt": 1,
  "nextStage": "publish-candidate"
}
