{
  "schemaVersion": "bilingual-review/v1",
  "reviewId": "br-fine-tuning-xhigh-language",
  "scope": {
    "moduleId": "fine-tuning",
    "locale": "en",
    "objectType": "module",
    "objectId": null,
    "zhContentHash": "sha256:16f9dec9113f770c0b82e3423ebb4e42515b1eafe0500d6765353cecca1ba2da",
    "enContentHash": "sha256:50231a2a2afdf22a42e18414587061b8c0defcbbeb3bfd132e1d943b2f2383d8",
    "termIds": [
      "dpo",
      "evaluation",
      "fine-tuning",
      "lora",
      "peft",
      "qlora",
      "sft"
    ],
    "sourceIds": [
      "deepseek-r1-2025",
      "dpo-2023",
      "finops-unit-economics",
      "hf-trl-chat-templates",
      "hf-trl-data-formats",
      "hf-trl-dpo-trainer",
      "hf-trl-peft",
      "hf-trl-sft-trainer",
      "instructgpt-2022",
      "lora-2021",
      "nist-genai-profile",
      "openai-eval-best-practices",
      "openai-structured-outputs",
      "qlora-2023"
    ]
  },
  "stage": "xhigh-language",
  "deterministic": [
    {
      "gateId": "technical-english",
      "status": "PASS",
      "evidence": [
        "American-English and unexplained-Chinese-prose gates pass.",
        "Reader-facing copy uses professional technical English without language-status filler.",
        "Module navigation preserves the canonical reading-role order."
      ]
    }
  ],
  "rubric": {
    "semanticFidelity": 5,
    "mechanismAccuracy": 5,
    "boundaryPreservation": 5,
    "evidenceFaithfulness": 5,
    "technicalEnglish": 5,
    "presalesUsability": 5
  },
  "findings": [],
  "verdict": "PASS",
  "blockClass": "NONE",
  "attempt": 1,
  "nextStage": "publish-candidate"
}
