{
  "schemaVersion": "bilingual-review/v1",
  "reviewId": "br-model-landscape-ultra-exception",
  "scope": {
    "moduleId": "model-landscape",
    "locale": "en",
    "objectType": "module",
    "objectId": null,
    "zhContentHash": "sha256:8d3890cd48a15ebcc346e599a58c91488ae059fbf02bfcd3be8cda3c81b2002d",
    "enContentHash": "sha256:a3284c1637a926b3e3866313a4dc9d543cb040e54850f545fa7df9d3ff48c353",
    "termIds": [
      "access-spectrum",
      "capability-matrix",
      "llm",
      "model-landscape",
      "model-lifecycle",
      "model-routing",
      "poc",
      "sla",
      "tco"
    ],
    "sourceIds": [
      "anthropic-models",
      "deepseek-r1-2025",
      "finops-unit-economics",
      "google-models",
      "lost-middle",
      "nist-ai-800-3",
      "nist-genai-profile",
      "openai-models",
      "openai-reasoning-guide",
      "opentelemetry-genai-semconv",
      "osi-open-source-ai-definition-1-0"
    ]
  },
  "stage": "ultra-exception",
  "deterministic": [
    {
      "gateId": "exception-adjudication",
      "status": "PASS",
      "evidence": [
        "The B1-B6 exception families are resolved and the shared-copy ownership policy covers the live conflict set.",
        "All canonical reading roles are present and all complete-edition, lint, build, and browser gates pass.",
        "No remaining content blocker was found in the final adjudication."
      ]
    }
  ],
  "rubric": {
    "semanticFidelity": 5,
    "mechanismAccuracy": 5,
    "boundaryPreservation": 5,
    "evidenceFaithfulness": 5,
    "technicalEnglish": 5,
    "presalesUsability": 5
  },
  "findings": [],
  "verdict": "PASS",
  "blockClass": "NONE",
  "attempt": 2,
  "nextStage": "publish-candidate"
}
