{
  "schemaVersion": "bilingual-review/v1",
  "reviewId": "br-ai-ops-2026-08-10-ultra-exception",
  "scope": {
    "moduleId": "ai-ops",
    "locale": "en",
    "objectType": "module",
    "objectId": null,
    "zhContentHash": "sha256:9f5b31013035b0ae39a5d75400f3958cac438fa8808a7b65f6953655188bfc42",
    "enContentHash": "sha256:75b15cfa7dc9cd74befc577fe0f3057911149b18c777b9f9364f0853ce66eb60",
    "termIds": [
      "ai-application-engineering",
      "ai-ops",
      "ai-release-manifest",
      "configuration-bundle",
      "cost-allocation",
      "cost-anomaly",
      "genaiops",
      "golden-set",
      "observability",
      "release-evaluation",
      "shadow-traffic"
    ],
    "sourceIds": [
      "aws-genai-lifecycle",
      "azure-foundation-model-lifecycle",
      "azure-genaiops",
      "finops-ai-category",
      "finops-ai-overview",
      "finops-framework",
      "google-genai-app-lifecycle",
      "nist-genai-profile",
      "nist-zero-trust",
      "openai-eval-best-practices",
      "opentelemetry-genai-semconv",
      "opentelemetry-semconv",
      "opentelemetry-tail-sampling"
    ]
  },
  "stage": "ultra-exception",
  "deterministic": [
    {
      "gateId": "exception-adjudication",
      "status": "PASS",
      "evidence": [
        "Final adjudication found no EVIDENCE, DYNAMIC_FACT, EDITORIAL_DISPUTE, or ENGINEERING blocker.",
        "Stable IDs, source bindings, dates, question and evidence-card order, terminology, and source-ledger keys were independently verified.",
        "The candidate passed targeted import, lint, build, and reader-copy regression checks before promotion."
      ]
    }
  ],
  "rubric": {
    "semanticFidelity": 5,
    "mechanismAccuracy": 5,
    "boundaryPreservation": 5,
    "evidenceFaithfulness": 5,
    "technicalEnglish": 5,
    "presalesUsability": 5
  },
  "findings": [],
  "verdict": "PASS",
  "blockClass": "NONE",
  "attempt": 2,
  "nextStage": "publish-candidate"
}
