{
  "schemaVersion": "bilingual-review/v1",
  "reviewId": "br-predictive-ai-mlops-ultra-exception",
  "scope": {
    "moduleId": "predictive-ai-mlops",
    "locale": "en",
    "objectType": "module",
    "objectId": null,
    "zhContentHash": "sha256:92a2f759d84eda39529605c397b15ab55e642b4d09867aabed97f9970d41441e",
    "enContentHash": "sha256:009803b61f650740e671f172d40ad128010781385dd11e8967bb2263f51214af",
    "termIds": [
      "feature-store",
      "model-drift",
      "model-registry",
      "point-in-time-correctness",
      "predictive-ai-mlops",
      "training-serving-skew"
    ],
    "sourceIds": [
      "aws-sagemaker-deployment-guardrails",
      "aws-sagemaker-feature-store",
      "aws-sagemaker-model-registry",
      "azure-ml-model-monitoring",
      "azure-ml-registries",
      "google-mlops-predictive-ai",
      "google-rules-of-ml",
      "ml-test-score-2017",
      "nist-genai-profile"
    ]
  },
  "stage": "ultra-exception",
  "deterministic": [
    {
      "gateId": "exception-adjudication",
      "status": "PASS",
      "evidence": [
        "The B1-B6 exception families are resolved and the shared-copy ownership policy covers the live conflict set.",
        "All canonical reading roles are present and all complete-edition, lint, build, and browser gates pass.",
        "No remaining content blocker was found in the final adjudication."
      ]
    }
  ],
  "rubric": {
    "semanticFidelity": 5,
    "mechanismAccuracy": 5,
    "boundaryPreservation": 5,
    "evidenceFaithfulness": 5,
    "technicalEnglish": 5,
    "presalesUsability": 5
  },
  "findings": [],
  "verdict": "PASS",
  "blockClass": "NONE",
  "attempt": 2,
  "nextStage": "publish-candidate"
}
