{
  "schemaVersion": "bilingual-review/v1",
  "reviewId": "br-a2a-2026-08-10-xhigh-author",
  "scope": {
    "moduleId": "a2a",
    "locale": "en",
    "objectType": "module",
    "objectId": null,
    "zhContentHash": "sha256:ee80da35910534cb222ef62c816c041d68afa12b2081f603b9762f51dcdd39f5",
    "enContentHash": "sha256:d9c8c22642219218f9c51d5659e1494cbc64775efe6692e4958df6a46d0c8791",
    "termIds": ["a2a", "agent-card", "a2a-message", "a2a-task", "artifact", "agent-collaboration", "identity-authorization"],
    "sourceIds": ["a2a-concepts", "a2a-mcp-boundary", "a2a-release-1-0-1", "a2a-specification", "anthropic-effective-agents", "mcp-tasks-extension", "nist-genai-profile", "nist-zero-trust", "opentelemetry-genai-semconv", "opentelemetry-semconv"]
  },
  "stage": "xhigh-author",
  "deterministic": [{
    "gateId": "english-module-contract",
    "status": "PASS",
    "evidence": [
      "The module was rewritten from protocol objects and operating boundaries rather than translated sentence by sentence.",
      "Message, Task, Artifact, cancellation, recovery, identity, and business-decision boundaries remain explicit and source-scoped.",
      "The localized source directory now contains exactly the ten canonical A2A sources used by reader-facing content."
    ]
  }],
  "rubric": {"semanticFidelity": 5, "mechanismAccuracy": 5, "boundaryPreservation": 5, "evidenceFaithfulness": 5, "technicalEnglish": 5, "presalesUsability": 5},
  "findings": [],
  "verdict": "PASS",
  "blockClass": "NONE",
  "attempt": 1,
  "nextStage": "publish-candidate"
}
