{
  "schemaVersion": "bilingual-review/v1",
  "reviewId": "br-ai-infra-platform-2026-08-10-xhigh-semantic",
  "scope": {
    "moduleId": "ai-infra-platform",
    "locale": "en",
    "objectType": "module",
    "objectId": null,
    "zhContentHash": "sha256:eba595d895db72deda5f49856900f2e05a695af5a5d4fc37cb211532aeb94021",
    "enContentHash": "sha256:d0aeea357fae70f745de90e50e4c3f77d0a4dc3123e70572fd54b69a6e174315",
    "termIds": [
      "ai-infra-platform",
      "batching",
      "distributed-training",
      "finops",
      "gang-scheduling",
      "goodput",
      "heterogeneous-compute",
      "observability",
      "resource-scheduling"
    ],
    "sourceIds": [
      "checkfreq-2021",
      "cncf-platforms-whitepaper",
      "finops-unit-economics",
      "kubernetes-dra",
      "kubernetes-dra-1-34-ga",
      "kubernetes-dra-1-36",
      "kubernetes-multi-tenancy",
      "kueue-all-or-nothing",
      "kueue-fair-sharing",
      "nist-zero-trust",
      "nvidia-gpu-operator",
      "oci-image-spec-v1-1-1",
      "opentelemetry-genai-semconv",
      "opentelemetry-semconv",
      "slurm-multifactor-priority",
      "slurm-overview",
      "torchsnapshot-checkpoint",
      "vllm-2023"
    ]
  },
  "stage": "xhigh-semantic",
  "deterministic": [
    {
      "gateId": "canonical-alignment",
      "status": "PASS",
      "evidence": [
        "Canonical question order, evidence relationships, evidence-card relationships, and addedAt values were independently checked against the Chinese owner.",
        "Independent semantic review confirmed the separation among platform resource economics, SLO-satisfying Goodput, application task criteria, and business ROI.",
        "The revision narrows wording where the cited evidence does not support a broader outcome claim."
      ]
    }
  ],
  "rubric": {
    "semanticFidelity": 5,
    "mechanismAccuracy": 5,
    "boundaryPreservation": 5,
    "evidenceFaithfulness": 5,
    "technicalEnglish": 5,
    "presalesUsability": 5
  },
  "findings": [],
  "verdict": "PASS",
  "blockClass": "NONE",
  "attempt": 2,
  "nextStage": "publish-candidate"
}
