{
  "schemaVersion": "bilingual-review/v1",
  "reviewId": "br-model-landscape-2026-08-10-xhigh-semantic",
  "scope": {
    "moduleId": "model-landscape",
    "locale": "en",
    "objectType": "module",
    "objectId": null,
    "zhContentHash": "sha256:3f2696ee2c225e6b8e6862c21e90731af17140aeb451609ef8341f9913202233",
    "enContentHash": "sha256:b873bb0f0ccfae12195d9317563a32df170e4a341e85497b013f17b691138d9e",
    "termIds": ["access-spectrum", "capability-matrix", "llm", "model-landscape", "model-lifecycle", "model-routing", "poc", "sla", "tco"],
    "sourceIds": ["agentic-index", "anthropic-models", "arena-leaderboard", "artificial-analysis-methodology", "artificial-analysis-models", "bfcl", "coding-index", "deepseek-r1-2025", "dify-enterprise-pricing", "dify-open-source-license", "financebench", "finops-unit-economics", "gdpval-aa-v2", "google-models", "gpqa-diamond", "humanity-last-exam", "intelligence-index", "livebench", "lost-middle", "nist-ai-800-3", "nist-genai-profile", "openai-models", "openai-reasoning-guide", "opentelemetry-genai-semconv", "osi-open-source-ai-definition-1-0", "scicode", "swe-bench", "swe-rebench", "tau3-banking", "terminal-bench", "terminal-bench-v21", "webarena-2024"]
  },
  "stage": "xhigh-semantic",
  "deterministic": [{
    "gateId": "canonical-alignment",
    "status": "PASS",
    "evidence": [
      "Independent review verified all 15 questions, four evidence cards, canonical evidence order, and addedAt values against the Chinese owner.",
      "All 32 local Model Landscape source copies resolve, including Dify terms, benchmark/radar sources, and provider catalogs.",
      "Every MaaS procurement dimension carries source links at the row where its claim is read."
    ]
  }],
  "rubric": {"semanticFidelity": 5, "mechanismAccuracy": 5, "boundaryPreservation": 5, "evidenceFaithfulness": 5, "technicalEnglish": 5, "presalesUsability": 5},
  "findings": [],
  "verdict": "PASS",
  "blockClass": "NONE",
  "attempt": 2,
  "nextStage": "publish-candidate"
}
