{
  "schemaVersion": "bilingual-review/v1",
  "reviewId": "br-ai-agent-2026-09-04-ultra-exception",
  "scope": {
    "moduleId": "ai-agent",
    "locale": "en",
    "objectType": "module",
    "objectId": null,
    "zhContentHash": "sha256:982e8368ead0f5d091524685af1063c9b1287e99fd94d3d5618efa25b26eabc1",
    "enContentHash": "sha256:a0e423b52ff07b656be916fe970de372de25e0ace67137731d409a092338f74e",
    "termIds": [
      "act",
      "agent-engineering",
      "ai-agent",
      "harness",
      "harness-engineering",
      "memory",
      "observe",
      "perceive",
      "planning",
      "reason",
      "tool-calling",
      "tools"
    ],
    "sourceIds": [
      "a2a-concepts",
      "a2a-task-lifecycle",
      "anthropic-agent-evals",
      "anthropic-effective-agents",
      "anthropic-tool-search",
      "aws-agentcore",
      "aws-agentcore-memory",
      "azure-durable-hitl",
      "azure-durable-orchestration",
      "azure-foundry-agent-service",
      "configuring-agentic-coding-tools",
      "google-agent-platform",
      "harness-bench-2026",
      "mcp-2026-07-28-rc",
      "mcp-architecture",
      "mcp-changelog-2026-07-28",
      "mcp-lifecycle-2025-11-25",
      "mcp-specification-2026-07-28",
      "mcp-tasks-2025-11-25",
      "mcp-tasks-extension",
      "metr-openai-hf-incident-2026",
      "microsoft-agent-harness",
      "ncsc-agentic-ai-risk-interim-2026",
      "nist-agent-standards",
      "nist-genai-profile",
      "nist-zero-trust",
      "oauth-token-exchange",
      "openai-agent-guide",
      "openai-agents-hitl",
      "openai-agents-run-loop",
      "openai-function-calling",
      "openai-harness-engineering",
      "openai-hugging-face-incident-technical-report-2026",
      "openai-model-spec-hidden-cot",
      "openai-source-sink-injection",
      "openapi-3-1-1",
      "opentelemetry-genai-observability-2026",
      "opentelemetry-genai-semconv",
      "opentelemetry-semconv",
      "owasp-llm-top-ten",
      "product-aider-docs",
      "product-antigravity-cli-migration",
      "product-antigravity-migration",
      "product-claude-code-docs",
      "product-cline-docs",
      "product-codebuddy-docs",
      "product-codex-docs",
      "product-comate-agent-docs",
      "product-cursor-docs",
      "product-devin-docs",
      "product-gemini-cli-individual-transition",
      "product-gemini-cli-releases",
      "product-github-copilot-coding-agent",
      "product-kimi-code-docs",
      "product-kiro-cli",
      "product-opencode-docs",
      "product-openhands-docs",
      "product-qoder-cn-ide",
      "product-qoder-cn-ide-changelog",
      "product-qoder-cn-series",
      "product-qwen-code-docs",
      "product-tongyi-lingma",
      "react-2023",
      "swe-bench",
      "swe-rebench",
      "terminal-bench",
      "webarena-2024"
    ]
  },
  "stage": "ultra-exception",
  "deterministic": [
    {
      "gateId": "ai-agent-ultra-exception-adjudication",
      "status": "PASS",
      "evidence": [
        "Final exception adjudication independently reviewed the current candidate and found no release-blocking semantic, language, evidence, or engineering exception.",
        "Failure paths cover interrupted runs, partially completed side effects, duplicate execution risk, permission revocation, and post-incident reconstruction.",
        "The candidate never treats a model decision as proof that an external side effect succeeded or that a business record is authoritative.",
        "The registered hashes, source scope, terminology scope, and preceding review stages match the current module candidate."
      ]
    }
  ],
  "rubric": {
    "semanticFidelity": 5,
    "mechanismAccuracy": 5,
    "boundaryPreservation": 5,
    "evidenceFaithfulness": 5,
    "technicalEnglish": 5,
    "presalesUsability": 5
  },
  "findings": [],
  "verdict": "PASS",
  "blockClass": "NONE",
  "attempt": 1,
  "nextStage": "publish-candidate"
}
