{
  "schemaVersion": "bilingual-review/v1",
  "reviewId": "br-llm-training-2026-08-10-xhigh-language",
  "scope": {
    "moduleId": "llm-training",
    "locale": "en",
    "objectType": "module",
    "objectId": null,
    "zhContentHash": "sha256:d9b36dd53bb1bbc49e4789ecf37eb49d68aa0d7fdb4b45e29400790fdb11af3a",
    "enContentHash": "sha256:31057f9128703d1e45b2a9f5d9deda2433dae7a03a3e57417c7054a7694feeaa",
    "termIds": [
      "distributed-training",
      "evaluation",
      "fine-tuning",
      "gang-scheduling",
      "llm-training",
      "pretraining",
      "rlhf",
      "scale-out",
      "scale-up",
      "sft",
      "transformer"
    ],
    "sourceIds": [
      "checkfreq-2021",
      "chinchilla-2022",
      "deduplicating-training-data-2022",
      "deepseek-r1-2025",
      "dpo-2023",
      "flashattention-2022",
      "hf-transformers-tokenizer-contract",
      "hf-trl-data-formats",
      "hf-trl-sft-trainer",
      "instructgpt-2022",
      "megatron-3d-parallelism-2021",
      "nccl-collectives",
      "nist-genai-profile",
      "openai-model-spec-hidden-cot",
      "opentelemetry-semconv",
      "pytorch-distributed-checkpoint",
      "pytorch-reproducibility",
      "sentencepiece-2018",
      "switch-transformer-2022",
      "torchsnapshot-checkpoint",
      "transformer-2017"
    ]
  },
  "stage": "xhigh-language",
  "deterministic": [
    {
      "gateId": "technical-english",
      "status": "PASS",
      "evidence": [
        "Independent language review confirmed direct professional technical English, lowercased generic run, and removed redundant discovery-question labels.",
        "Reader-facing discovery questions use the renderer's label once, start with a capital letter, and preserve the original customer intent.",
        "Terminology, capitalization, and acceptance language follow the English editorial standard."
      ]
    }
  ],
  "rubric": {
    "semanticFidelity": 5,
    "mechanismAccuracy": 5,
    "boundaryPreservation": 5,
    "evidenceFaithfulness": 5,
    "technicalEnglish": 5,
    "presalesUsability": 5
  },
  "findings": [],
  "verdict": "PASS",
  "blockClass": "NONE",
  "attempt": 2,
  "nextStage": "publish-candidate"
}
