{
  "schemaVersion": "bilingual-review/v1",
  "reviewId": "br-ai-infra-platform-xhigh-language",
  "scope": {
    "moduleId": "ai-infra-platform",
    "locale": "en",
    "objectType": "module",
    "objectId": null,
    "zhContentHash": "sha256:93c403c1747e3ea1d81e97d32305da3a93342d678fd5eab2a51beda31f0edb88",
    "enContentHash": "sha256:9680b12b339473603a0dc7d12545a6db721e4c7fad5fd1fced9e3db8d95b8b13",
    "termIds": [
      "ai-infra-platform",
      "batching",
      "distributed-training",
      "finops",
      "gang-scheduling",
      "goodput",
      "heterogeneous-compute",
      "observability",
      "resource-scheduling"
    ],
    "sourceIds": [
      "checkfreq-2021",
      "cncf-platforms-whitepaper",
      "finops-unit-economics",
      "kubernetes-dra",
      "kubernetes-dra-1-34-ga",
      "kubernetes-dra-1-36",
      "kubernetes-multi-tenancy",
      "kueue-all-or-nothing",
      "kueue-fair-sharing",
      "nist-zero-trust",
      "nvidia-gpu-operator",
      "oci-image-spec-v1-1-1",
      "opentelemetry-genai-semconv",
      "opentelemetry-semconv",
      "slurm-multifactor-priority",
      "slurm-overview",
      "torchsnapshot-checkpoint",
      "vllm-2023"
    ]
  },
  "stage": "xhigh-language",
  "deterministic": [
    {
      "gateId": "technical-english",
      "status": "PASS",
      "evidence": [
        "American-English and unexplained-Chinese-prose gates pass.",
        "Reader-facing copy uses professional technical English without language-status filler.",
        "Module navigation preserves the canonical reading-role order."
      ]
    }
  ],
  "rubric": {
    "semanticFidelity": 5,
    "mechanismAccuracy": 5,
    "boundaryPreservation": 5,
    "evidenceFaithfulness": 5,
    "technicalEnglish": 5,
    "presalesUsability": 5
  },
  "findings": [],
  "verdict": "PASS",
  "blockClass": "NONE",
  "attempt": 1,
  "nextStage": "publish-candidate"
}
