{
  "schemaVersion": "bilingual-review/v1",
  "reviewId": "br-evaluation-xhigh-semantic",
  "scope": {
    "moduleId": "evaluation",
    "locale": "en",
    "objectType": "module",
    "objectId": null,
    "zhContentHash": "sha256:70b0271cf44496ed2d3774899693fee09f70845f713061e976ddec13f18e56f1",
    "enContentHash": "sha256:abf8b0bc30be5b84530d024890894a186f412e64e22ed945bc46ffde55971fa9",
    "termIds": [
      "ai-ops",
      "capability-matrix",
      "evaluation",
      "evaluation-contract",
      "evaluation-layers",
      "golden-set",
      "governance-evidence",
      "grounding",
      "hitl",
      "impact-assessment",
      "llm-as-judge",
      "model-lifecycle",
      "observability",
      "poc",
      "release-evaluation"
    ],
    "sourceIds": [
      "anthropic-agent-evals",
      "llm-as-judge-2023",
      "nist-ai-800-3",
      "nist-ai-800-4",
      "nist-genai-profile",
      "opentelemetry-genai-semconv",
      "ragas"
    ]
  },
  "stage": "xhigh-semantic",
  "deterministic": [
    {
      "gateId": "canonical-alignment",
      "status": "PASS",
      "evidence": [
        "Question order, evidence relationships, evidence-card relationships, and addedAt values match the canonical owner.",
        "Mechanism, decision, failure, control, and evidence boundaries were cross-reviewed against the Chinese source and primary evidence."
      ]
    }
  ],
  "rubric": {
    "semanticFidelity": 5,
    "mechanismAccuracy": 5,
    "boundaryPreservation": 5,
    "evidenceFaithfulness": 5,
    "technicalEnglish": 4,
    "presalesUsability": 5
  },
  "findings": [],
  "verdict": "PASS",
  "blockClass": "NONE",
  "attempt": 1,
  "nextStage": "publish-candidate"
}
