{
  "schemaVersion": "bilingual-review/v1",
  "reviewId": "br-ai-infra-compute-ultra-exception",
  "scope": {
    "moduleId": "ai-infra-compute",
    "locale": "en",
    "objectType": "module",
    "objectId": null,
    "zhContentHash": "sha256:7f0133f49baf3061f63a015be6a5210dc92669a6803c51fc6d0807295fbea694",
    "enContentHash": "sha256:ea2bc71c0072929048e7fda6c19620283941d1c691a24a08afb467478774632f",
    "termIds": [
      "access-spectrum",
      "ai-infra-compute",
      "hbm",
      "heterogeneous-compute",
      "kv-cache",
      "scale-out",
      "scale-up",
      "tco",
      "vram"
    ],
    "sourceIds": [
      "chinchilla-2022",
      "finops-ai-category",
      "finops-unit-economics",
      "flashattention-2022",
      "megatron-3d-parallelism-2021",
      "mlperf-inference-datacenter",
      "mlperf-storage-v2",
      "mlperf-training",
      "nccl-collectives",
      "nist-genai-profile",
      "nist-zero-trust",
      "nvidia-dgx-h100-data-center",
      "nvidia-gpu-operator",
      "opentelemetry-semconv",
      "roofline-2009",
      "torchsnapshot-checkpoint",
      "vllm-2023"
    ]
  },
  "stage": "ultra-exception",
  "deterministic": [
    {
      "gateId": "exception-adjudication",
      "status": "PASS",
      "evidence": [
        "The B1-B6 exception families are resolved and the shared-copy ownership policy covers the live conflict set.",
        "All canonical reading roles are present and all complete-edition, lint, build, and browser gates pass.",
        "No remaining content blocker was found in the final adjudication."
      ]
    }
  ],
  "rubric": {
    "semanticFidelity": 5,
    "mechanismAccuracy": 5,
    "boundaryPreservation": 5,
    "evidenceFaithfulness": 5,
    "technicalEnglish": 5,
    "presalesUsability": 5
  },
  "findings": [],
  "verdict": "PASS",
  "blockClass": "NONE",
  "attempt": 2,
  "nextStage": "publish-candidate"
}
