{
  "schemaVersion": "bilingual-review/v1",
  "reviewId": "br-ai-agent-2026-08-10-xhigh-semantic",
  "scope": {
    "moduleId": "ai-agent",
    "locale": "en",
    "objectType": "module",
    "objectId": null,
    "zhContentHash": "sha256:ac301a4fd3c2f9d4e4535957cecac9276b3f406a35c9c7eef0a3bab2c5865592",
    "enContentHash": "sha256:5d2403f6c041416e9f6581862b2fae69cc2447a08fee50058c5b48b03dfb62fa",
    "termIds": ["ai-agent", "harness", "harness-engineering", "agent-engineering", "perceive", "reason", "act", "observe", "planning", "memory", "tools"],
    "sourceIds": ["a2a-concepts", "a2a-task-lifecycle", "anthropic-agent-evals", "anthropic-effective-agents", "anthropic-tool-search", "aws-agentcore", "aws-agentcore-memory", "azure-durable-hitl", "azure-durable-orchestration", "azure-foundry-agent-service", "configuring-agentic-coding-tools", "google-agent-platform", "harness-bench-2026", "mcp-architecture", "mcp-specification-2026-07-28", "microsoft-agent-harness", "nist-agent-standards", "nist-genai-profile", "nist-zero-trust", "oauth-token-exchange", "openai-agent-guide", "openai-agents-hitl", "openai-agents-run-loop", "openai-function-calling", "openai-harness-engineering", "openai-model-spec-hidden-cot", "openapi-3-1-1", "opentelemetry-genai-semconv", "opentelemetry-semconv", "owasp-llm-top-ten", "react-2023", "webarena-2024"]
  },
  "stage": "xhigh-semantic",
  "deterministic": [{
    "gateId": "agent-control-boundary-review",
    "status": "PASS",
    "evidence": [
      "Memory writes are classified by provenance and trust, then controlled through approval, scope, freshness, influence tracing, deletion, and recovery.",
      "The memory section explicitly rejects extrapolating lab attack rates to production incidence.",
      "The low-code comparison uses control-surface decisions rather than unsupported product capability or pricing claims."
    ]
  }],
  "rubric": {"semanticFidelity": 5, "mechanismAccuracy": 5, "boundaryPreservation": 5, "evidenceFaithfulness": 5, "technicalEnglish": 5, "presalesUsability": 5},
  "findings": [],
  "verdict": "PASS",
  "blockClass": "NONE",
  "attempt": 1,
  "nextStage": "publish-candidate"
}
