{
  "schemaVersion": "bilingual-review/v1",
  "reviewId": "br-llm-xhigh-semantic",
  "scope": {
    "moduleId": "llm",
    "locale": "en",
    "objectType": "module",
    "objectId": null,
    "zhContentHash": "sha256:5f78d65a08aa05e3cdf265cf8aef83d8911145ac70ebe203cdb590901845e2bc",
    "enContentHash": "sha256:ed827e65886e27b7e321f32947b0853c5415776af0185732482844d01066e805",
    "termIds": [
      "attention",
      "context-window",
      "embedding",
      "generation",
      "kv-cache",
      "llm",
      "moe",
      "pretraining",
      "qkv",
      "token",
      "transformer"
    ],
    "sourceIds": [
      "anthropic-models",
      "attention-not-explanation-2019",
      "chinchilla-2022",
      "deepseek-r1-2025",
      "dpr-2020",
      "flashattention-2022",
      "google-models",
      "gqa-2023",
      "instructgpt-2022",
      "lost-middle",
      "nist-genai-profile",
      "nist-zero-trust",
      "openai-model-spec-hidden-cot",
      "openai-models",
      "sentencepiece-2018",
      "switch-transformer-2022",
      "transformer-2017",
      "vllm-2023"
    ]
  },
  "stage": "xhigh-semantic",
  "deterministic": [
    {
      "gateId": "canonical-alignment",
      "status": "PASS",
      "evidence": [
        "Question order, evidence relationships, evidence-card relationships, and addedAt values match the canonical owner.",
        "Mechanism, decision, failure, control, and evidence boundaries were cross-reviewed against the Chinese source and primary evidence."
      ]
    }
  ],
  "rubric": {
    "semanticFidelity": 5,
    "mechanismAccuracy": 5,
    "boundaryPreservation": 5,
    "evidenceFaithfulness": 5,
    "technicalEnglish": 4,
    "presalesUsability": 5
  },
  "findings": [],
  "verdict": "PASS",
  "blockClass": "NONE",
  "attempt": 1,
  "nextStage": "publish-candidate"
}
